{
  "schema_version": "MONO_CI_B0_PSI_DELTA_A5_READINESS_V1",
  "study_id": "MONO_CI_B0_PSI_DELTA_A5_COMPARISON_V1",
  "assessment_date": "2026-10-27",
  "subject": {
    "before_state": "A0_4_REPORT_QUERY_PORT",
    "after_state": "A0_5_MODULE_DATA_OWNERSHIP",
    "source_identities": [
      {
        "state": "A0_4_REPORT_QUERY_PORT",
        "commit_sha": "d3101c0d3aa9b7b709253b6ec7518416f05f65b9",
        "repository_tree_sha": "2b436e0aaf09403ea516d73d20a466a122f86592",
        "application_tree_sha": "007196f68652bc13f6798805793ffdfae96f95f7",
        "state_manifest_path": "architecture/states/A0_4_REPORT_QUERY_PORT.yaml",
        "state_manifest_sha256": "9c981442a34830bdc44d77ffc17de5b9f832b0b261d0d92f28bd15dc567febd9"
      },
      {
        "state": "A0_5_MODULE_DATA_OWNERSHIP",
        "commit_sha": "a349d19fb89b577e6799e9736ed4ce0acc572166",
        "repository_tree_sha": "97c060cc26313a879f0940a178d42e422cc4d188",
        "application_tree_sha": "007196f68652bc13f6798805793ffdfae96f95f7",
        "state_manifest_path": "architecture/states/A0_5_MODULE_DATA_OWNERSHIP.yaml",
        "state_manifest_sha256": "2906216b212b450706368d44233488fd638d2e7af789980ea2abf02740a04ae8"
      }
    ],
    "policy_change": {
      "kind": "POLICY_ACTIVATION",
      "description": "A0.5 declares ownership of capability repositories, ORM models and tables; A0.4 marks the ownership evaluator NOT_APPLICABLE.",
      "table_owners": {
        "users": "users",
        "tasks": "tasks",
        "notifications": "notifications",
        "audit_events": "audit"
      },
      "model_registry_exception": "app/db/model_registry.py only",
      "prohibited_patterns": [
        "FOREIGN_REPOSITORY_IMPORT",
        "FOREIGN_ORM_MODEL_IMPORT_OR_USE",
        "FOREIGN_TABLE_CONSTRUCTION_OR_METADATA_LOOKUP"
      ],
      "mapping_id": "MAP-PERSISTENCE-OWNERSHIP-TO-A1-DATA-OWNERSHIP-V1",
      "authority_status": "DECLARED_ENGINEERING_REQUIREMENT_NOT_INDEPENDENTLY_APPROVED"
    },
    "application_code_change": {
      "before_application_tree_sha": "007196f68652bc13f6798805793ffdfae96f95f7",
      "after_application_tree_sha": "007196f68652bc13f6798805793ffdfae96f95f7",
      "same_tree": true,
      "claim": "Policy/enforcement milestone; no application refactor is evidenced."
    }
  },
  "source_artifacts": [
    {
      "path": "architecture/states/A0_4_REPORT_QUERY_PORT.yaml",
      "sha256": "9c981442a34830bdc44d77ffc17de5b9f832b0b261d0d92f28bd15dc567febd9"
    },
    {
      "path": "architecture/states/A0_5_MODULE_DATA_OWNERSHIP.yaml",
      "sha256": "2906216b212b450706368d44233488fd638d2e7af789980ea2abf02740a04ae8"
    },
    {
      "path": "architecture/acceptance/a1/public_api_v1.yaml",
      "sha256": "8853c3a933b23f698c7ba7c5b6e511f292e8d9285dc0de4378741c53e466f7bb"
    },
    {
      "path": "architecture/acceptance/a1/module_graph_v1.yaml",
      "sha256": "1abae6871a477ff2a07685ad645a70defa2f1ac6745598ae4cdc35aab4e95bf6"
    },
    {
      "path": "architecture/acceptance/a1/data_ownership_v1.yaml",
      "sha256": "4c8a1b4bfcdc20d49c49d47d4e9fc8192611994dd269a85d362ddc2f62320b6e"
    },
    {
      "path": "architecture/acceptance/a1/__init__.py",
      "sha256": "cea0f2f68a149ae8c99c0c114bebf658867c8c8123399d5d1fe76c2f47cac569"
    },
    {
      "path": "architecture/acceptance/a1/analyzers.py",
      "sha256": "b67b21c1f78a39382a0ed8692d8bd350ff71b1261a448af4b78e83fe7f2eb1a2"
    },
    {
      "path": "architecture/acceptance/a1/cli.py",
      "sha256": "ad03caa866c09ae71784bbfca428f074a4b54ea097d182717e7f4ce15024997a"
    },
    {
      "path": "architecture/acceptance/a1/engine.py",
      "sha256": "06359bf5e40ed69291f6a3e3dd827a0e419ac0cd5ff3d4b53c8154d4ddc7718f"
    },
    {
      "path": "experiments/execution/mono-ci-b0-psi-execution-a05-v1/RECONSTRUCTED_B0_A04_V1.json",
      "sha256": "9a8c15fabc41ec6e079b3ec708a60dcc0320fa5e7370e1416123e9ec4f64643d"
    },
    {
      "path": "fitness/catalog/architectural-obligations.yaml",
      "sha256": "8c5bd8fffe3bdb2af8fb85f8d0012bc34673f72866e52daed99fab96f9763011"
    },
    {
      "path": "fitness/traceability/a0-traceability.yaml",
      "sha256": "b89b4279d86b20091a86862d5538539257dd669321d2df66138d51df98c28a08"
    },
    {
      "path": "experiments/execution/tooling/p_adaptation.py",
      "sha256": "149579f43a13b246452dcdc15fbb0f9f549cf2fd4420fe98701fa14c8a50bc05"
    },
    {
      "path": "experiments/execution/tooling/p_impact.py",
      "sha256": "d914de3ae7f7ccd1192ba29263d825d66915e65f260981d3a9577fad7c5d5b73"
    },
    {
      "path": "experiments/execution/tooling/p_semantic.py",
      "sha256": "2aea36fa338473d624f58a1c653ab2f808e88c4dece931bb6df75ca71d76db9a"
    },
    {
      "path": "experiments/execution/tooling/p_operations.py",
      "sha256": "780580c89bfb4d5ef66b32cf3d9c546843d105736bc2c65deb45cc3a9a3654f4"
    },
    {
      "path": "experiments/execution/tooling/p_candidate.py",
      "sha256": "485f7353944f629a79ec2f50b0cde70de9cc95ffc7dd6eb0047b0883ef282e12"
    },
    {
      "path": "experiments/execution/tooling/p_governance.py",
      "sha256": "39bf05fccac7b3c62bf06baaaa4537d1a794b0f25476a7cd279d4bb17c1643da"
    },
    {
      "path": "experiments/execution/tooling/p_interface.py",
      "sha256": "b16da67d77f31dc95e70feb459f71c0f875ad0c0a6ba8680dc41cc9fcefae0ea"
    },
    {
      "path": "experiments/execution/schemas/method_input_v3_candidate.schema.json",
      "sha256": "fbcee8570621127b8347bf600d0ed50d345abdb3b23cdf1dd41a5f419ad10181"
    },
    {
      "path": "experiments/execution/schemas/p_adaptation_evidence_v2.schema.json",
      "sha256": "4890acdad4d948a30d85cdc8bf6185760ffb60860efbd892bf0e7cf121426c0d"
    },
    {
      "path": "experiments/execution/schemas/p_candidate_configuration_v1.schema.json",
      "sha256": "cd13f69ce004dcdaa9cfe62e1f4e88e0c45f1aa9beaeefd63f705412324e512f"
    },
    {
      "path": "experiments/execution/schemas/p_operation_plan_v1.schema.json",
      "sha256": "47a932c8aca3764cf1adb2ac044c65cf4bfaeff5c16eff21c7cd9312dea42d74"
    },
    {
      "path": "experiments/execution/schemas/p_cost_model_v1.schema.json",
      "sha256": "02921619ec17a603c7753dfb783887b131d0cd855e89e40cc977416d31ce71ea"
    },
    {
      "path": "experiments/execution/schemas/applicability_ruleset_v1.schema.json",
      "sha256": "b7c856b0f919102bfac2a6b1e8f0fa347a8c8afd29554b07d8280165ce029326"
    },
    {
      "path": "experiments/execution/schemas/architecture_policy_snapshot_v1_2.schema.json",
      "sha256": "42362a4cd62b2e2ae2f0f45e99eead33d3fa14dab3978f955bde722499c57106"
    },
    {
      "path": "experiments/execution/contracts/fact_vocabulary_v1.json",
      "sha256": "ba83520a5c73187459b2d07bf2a49140cd9feef6f55e5c88c746b6b93a4a0856"
    },
    {
      "path": "experiments/execution/da01/P_ALGORITHM_STATUS.md",
      "sha256": "7c9bed6a9ab7f807727d584bef1189773405c82b60e1a402701b7c04e4fbc111"
    },
    {
      "path": "docs/G1_METHOD_DECISION_REGISTER.md",
      "sha256": "f6254d88e4204335e502027191ca1b0876f21132fd456a937df26a4885f3d283"
    },
    {
      "path": "docs/MONO_E1_POLICY_APPROVAL_PREPARATION_V1.md",
      "sha256": "c3f40ef9adfee3edaa0f9cbb9a36a7a4c70d60c84a4c741498bbabd8d7cbfed1"
    },
    {
      "path": ".github/workflows/mono-ci-psi-a05-development.yml",
      "sha256": "fbd05162bac73aee375549a9ab32d3a1ae877df4d73fce017d606870036570e5"
    }
  ],
  "baseline": {
    "path": "experiments/execution/mono-ci-b0-psi-execution-a05-v1/RECONSTRUCTED_B0_A04_V1.json",
    "sha256": "9a8c15fabc41ec6e079b3ec708a60dcc0320fa5e7370e1416123e9ec4f64643d",
    "identity_status": "PROSPECTIVE_RECONSTRUCTED_BASELINE",
    "historical_identity": "NOT_FOUND",
    "active_controls": [
      "AC_PUBLIC_API",
      "AC_MODULE_GRAPH"
    ],
    "operations_emitted": false,
    "approval_status": "NOT_APPROVED",
    "method_input_authorized": false,
    "measurement_authorized": false,
    "coverage_status": "UNKNOWN",
    "limitations": [
      "Prospective reconstruction, not actual historical baseline.",
      "Not complete approved mandatory denominator.",
      "B0 emits no synthetic RETAIN or governance decision."
    ]
  },
  "applicability_profile": {
    "authority_status": "ENGINEERING_POLICY_DECLARED",
    "independent_review_status": "PENDING",
    "catalog_path": "fitness/catalog/architectural-obligations.yaml",
    "catalog_sha256": "8c5bd8fffe3bdb2af8fb85f8d0012bc34673f72866e52daed99fab96f9763011",
    "catalog_closure_status": "OPEN",
    "state_manifest_sha256": "2906216b212b450706368d44233488fd638d2e7af789980ea2abf02740a04ae8",
    "proposed_ci_review_targets": [
      "AC_PUBLIC_API",
      "AC_MODULE_GRAPH",
      "AC_DATA_OWNERSHIP"
    ],
    "valid_until": null,
    "scope_rationale": "These three static controls are reviewable in CI; this does not establish a complete denominator. Other catalog rows are unresolved, not excluded. CI_TEST is proposed only; deployment/runtime stages remain UNKNOWN.",
    "authority_requirements": [
      "Appoint accountable authority; define mandatory semantics, closure, trust roots, expiry and revocation.",
      "Independent methods reviewer approves bounded CI denominator, stages and uncertainty rules.",
      "Do not derive status from evaluator configuration or an expected operation."
    ],
    "conflict_semantics": "Conflicting, incomplete, empty, outdated, stale or unauthorized evidence yields UNKNOWN and never INACTIVE.",
    "rows": [
      {
        "obligation_id": "P_EXT_LATENCY",
        "applicability": "UNKNOWN",
        "mandatory_status": "UNKNOWN",
        "lifecycle_status": "UNKNOWN",
        "lifecycle_stages": [],
        "scope_disposition": "UNRESOLVED_NOT_DROPPED",
        "conflict": false,
        "source_fact_refs": []
      },
      {
        "obligation_id": "P_REMOTE_LATENCY",
        "applicability": "UNKNOWN",
        "mandatory_status": "UNKNOWN",
        "lifecycle_status": "UNKNOWN",